{
  "schemaVersion": "hcmo-v1",
  "experiment": {
    "experimentId": "exp-demo-partner-alpha-sentinel-set-a-dc43eea004",
    "name": "Demo Partner Alpha / Sentinel_Set_A (2026-01-15)",
    "collaborator": "Demo Partner Alpha",
    "cohortName": "Sentinel_Set_A",
    "goal": "Metadata harmonization for preclinical home-cage monitoring data.",
    "type": "home_cage_monitoring",
    "startAt": "2026-01-15",
    "endAt": "2026-01-22",
    "testingLocation": "Room A1",
    "timezone": "Europe/Paris",
    "primaryOutcomeMeasure": "Locomotor Activity"
  },
  "environmentHousing": {
    "lightCycle": "12:00 LD",
    "lightsOnAt": "06:00",
    "dawnDusk": "yes",
    "dawnDuskDuration": "00:30",
    "timezone": "Europe/Paris"
  },
  "homeCageMonitoring": {
    "system": "DVC",
    "variables": [
      {
        "name": "Food Intake",
        "unit": "g",
        "dataType": "Food Intake"
      },
      {
        "name": "Locomotor Activity",
        "unit": "count/min",
        "dataType": "Activity"
      },
      {
        "name": "Nest Time",
        "unit": "min",
        "dataType": "Observation"
      }
    ],
    "recordingFrequency": "15min",
    "recordedStartAt": "2026-01-15T06:00:00",
    "recordedEndAt": "2026-01-22T06:00:00"
  },
  "cages": [
    {
      "cageId": "cage-exp-demo-partner-alpha-sentinel-set-a-dc-74533a75ec",
      "experimentId": "exp-demo-partner-alpha-sentinel-set-a-dc43eea004",
      "sourceCageIdentifier": "DVC-ALPHA-01",
      "type": "hcm",
      "animalsPerCage": 4,
      "hasEnrichments": "yes",
      "lightCycle": "12:00 LD",
      "lightsOnAt": "06:00",
      "dawnDusk": "yes",
      "dawnDuskDuration": "00:30",
      "timezone": "Europe/Paris",
      "remarks": "2026-01-10"
    },
    {
      "cageId": "cage-exp-demo-partner-alpha-sentinel-set-a-dc-a1ac02cd76",
      "experimentId": "exp-demo-partner-alpha-sentinel-set-a-dc43eea004",
      "sourceCageIdentifier": "DVC-ALPHA-02",
      "type": "hcm",
      "animalsPerCage": 3,
      "hasEnrichments": "yes",
      "lightCycle": "12:00 LD",
      "lightsOnAt": "06:00",
      "dawnDusk": "yes",
      "dawnDuskDuration": "00:30",
      "timezone": "Europe/Paris",
      "remarks": "2026-01-18"
    }
  ],
  "subjects": [
    {
      "subjectId": "subject-exp-demo-partner-alpha-sentinel-set-a-dc-3888b6e922",
      "experimentId": "exp-demo-partner-alpha-sentinel-set-a-dc43eea004",
      "cageId": "cage-exp-demo-partner-alpha-sentinel-set-a-dc-a1ac02cd76",
      "localIdentifiers": [
        "RackA02"
      ],
      "species": "mouse",
      "sex": "male",
      "birthAt": "2025-08-31",
      "strain": "C57BL/6J",
      "strainShortName": "B6",
      "transgenic": "yes",
      "genotype": "Reporter line",
      "alleleInformation": "Allele-7",
      "vendor": "Generic Vendor 1",
      "developmentalStage": "Adult",
      "startingWeight": 24.1,
      "weightUnit": "g",
      "severityGrade": "subthreshold",
      "remarks": "Synthetic example row 2"
    },
    {
      "subjectId": "subject-exp-demo-partner-alpha-sentinel-set-a-dc-b388fe82e6",
      "experimentId": "exp-demo-partner-alpha-sentinel-set-a-dc43eea004",
      "cageId": "cage-exp-demo-partner-alpha-sentinel-set-a-dc-74533a75ec",
      "sourceAnimalIdentifier": "ALPHA-001",
      "localIdentifiers": [
        "RackA01",
        "RFID1001"
      ],
      "species": "mouse",
      "sex": "female",
      "birthAt": "2025-01-10",
      "strain": "C57BL/6J",
      "strainShortName": "B6",
      "transgenic": "no",
      "genotype": "Wild type",
      "vendor": "Generic Vendor 1",
      "developmentalStage": "Adult",
      "startingWeight": 21.4,
      "weightUnit": "g",
      "severityGrade": "mild",
      "remarks": "Synthetic example row 1"
    }
  ],
  "procedures": [
    {
      "procedureId": "proc-subject-exp-demo-partner-alpha-sentinel--77df91806e",
      "subjectId": "subject-exp-demo-partner-alpha-sentinel-set-a-dc-b388fe82e6",
      "experimentId": "exp-demo-partner-alpha-sentinel-set-a-dc43eea004",
      "cageId": "cage-exp-demo-partner-alpha-sentinel-set-a-dc-74533a75ec",
      "procedureType": "treatment",
      "name": "Compound A",
      "protocol": "Daily gavage",
      "startAt": "2026-01-15",
      "endAt": "2026-01-22",
      "state": "completed",
      "treatmentType": "pharmacological",
      "category": "chronic",
      "drug": "Compound A",
      "casNumber": "111-11-1",
      "dose": 5.0,
      "doseUnit": "mg/kg",
      "route": "oral",
      "administrationMethod": "Daily gavage",
      "vehicleComposition": "Vehicle A",
      "remarks": "Synthetic example row 1"
    },
    {
      "procedureId": "proc-subject-exp-demo-partner-alpha-sentinel--7aceb32943",
      "subjectId": "subject-exp-demo-partner-alpha-sentinel-set-a-dc-3888b6e922",
      "experimentId": "exp-demo-partner-alpha-sentinel-set-a-dc43eea004",
      "cageId": "cage-exp-demo-partner-alpha-sentinel-set-a-dc-a1ac02cd76",
      "procedureType": "treatment",
      "name": "Compound A",
      "protocol": "Daily gavage",
      "startAt": "2026-01-15",
      "endAt": "2026-01-22",
      "state": "completed",
      "treatmentType": "pharmacological",
      "category": "chronic",
      "drug": "Compound A",
      "casNumber": "111-11-1",
      "dose": 5.0,
      "doseUnit": "mg/kg",
      "route": "oral",
      "administrationMethod": "Daily gavage",
      "vehicleComposition": "Vehicle A",
      "remarks": "Synthetic example row 2"
    }
  ],
  "dataAssets": [
    {
      "assetId": "asset-exp-demo-partner-alpha-sentinel-set-a-dc-1e85ef3dcc",
      "experimentId": "exp-demo-partner-alpha-sentinel-set-a-dc43eea004",
      "cageId": "cage-exp-demo-partner-alpha-sentinel-set-a-dc-a1ac02cd76",
      "subjectId": "subject-exp-demo-partner-alpha-sentinel-set-a-dc-3888b6e922",
      "assetType": "time_series_reference",
      "system": "DVC",
      "outcomeMeasure": "Food Intake",
      "valueKind": "TimeSeries",
      "unit": "g",
      "timezone": "Europe/Paris",
      "recordedStartAt": "2026-01-15T06:00:00",
      "recordedEndAt": "2026-01-22T06:00:00",
      "recordingDuration": "168h",
      "recordingFrequency": "15min",
      "sourceFileName": "mnms_sample.csv",
      "sourceSheetName": "csv",
      "sourceRowNumber": 3,
      "remark": "Synthetic example row 2"
    },
    {
      "assetId": "asset-exp-demo-partner-alpha-sentinel-set-a-dc-b14ebf0c01",
      "experimentId": "exp-demo-partner-alpha-sentinel-set-a-dc43eea004",
      "cageId": "cage-exp-demo-partner-alpha-sentinel-set-a-dc-74533a75ec",
      "subjectId": "subject-exp-demo-partner-alpha-sentinel-set-a-dc-b388fe82e6",
      "assetType": "time_series_reference",
      "system": "DVC",
      "outcomeMeasure": "Locomotor Activity",
      "valueKind": "TimeSeries",
      "unit": "count/min",
      "timezone": "Europe/Paris",
      "recordedStartAt": "2026-01-15T06:00:00",
      "recordedEndAt": "2026-01-22T06:00:00",
      "recordingDuration": "168h",
      "recordingFrequency": "1min",
      "sourceFileName": "mnms_sample.csv",
      "sourceSheetName": "csv",
      "sourceRowNumber": 2,
      "remark": "Synthetic example row 1"
    },
    {
      "assetId": "asset-exp-demo-partner-alpha-sentinel-set-a-dc-d1c035e823",
      "experimentId": "exp-demo-partner-alpha-sentinel-set-a-dc43eea004",
      "cageId": "cage-exp-demo-partner-alpha-sentinel-set-a-dc-74533a75ec",
      "subjectId": "subject-exp-demo-partner-alpha-sentinel-set-a-dc-b388fe82e6",
      "assetType": "time_series_reference",
      "system": "DVC",
      "outcomeMeasure": "Nest Time",
      "valueKind": "TimeSeries",
      "unit": "min",
      "timezone": "Europe/Paris",
      "recordedStartAt": "2026-01-15T06:00:00",
      "recordedEndAt": "2026-01-22T06:00:00",
      "recordingDuration": "168h",
      "recordingFrequency": "30min",
      "sourceFileName": "mnms_sample.csv",
      "sourceSheetName": "csv",
      "sourceRowNumber": 4,
      "remark": "Synthetic example row 3"
    }
  ]
}
